,comments,pub_dates,like_Counts
556,"Watch this movie without fail. I have watched this in the last Film Festival in Bangalore and absolutely Loved it. The kid is brilliant. He is a fan of Sallu Bhai. Sallu should learn to act from this kid and he should in-turn, be a fan of this kid, not the other way around.",2016-04-07T14:34:35.000Z,0
557,"Think this will be better than FAN, what an irony for SRK",2016-04-07T14:03:47.000Z,0
558,The name of movie should be..' jr FAN',2016-04-07T13:54:59.000Z,0
559,looks promising....,2016-04-07T13:51:38.000Z,0
560,i don't know why people over here are just talking about SRK? don't u see the acting of these kids in this trailer or u guys don't wanna see their wesome work..... may be SRK is ur god but work done by these kids are much better than SRK ~_~,2016-04-07T12:32:37.000Z,0
561,This is the real FAN film :),2016-04-07T11:53:57.000Z,26
562,nice,2016-04-07T11:17:21.000Z,0
563,And looks like he's back with a bang again,2016-04-07T11:01:40.000Z,0
564,The kid is wearing Salman Khan Style Bracelet...,2016-04-07T10:53:44.000Z,0
565,love the concept and love the acting of the actors must watch movie i wish this years biggest hit movie.big thumbsup,2016-04-07T10:40:08.000Z,0
566,This is beautiful. Hope it turns out to be another master piece by Nagesh Kukunoor.,2016-04-07T10:32:04.000Z,11
567,Goosebumps,2016-04-07T10:07:39.000Z,0
568,"omg I luvd this, exited gud to have nagesh sir back",2016-04-07T10:05:31.000Z,0
569,Brilliant!,2016-04-07T09:48:57.000Z,0
570,"After a long time, a trailer brought a smile to my face..",2016-04-07T09:15:17.000Z,0
571,WTF. uske 9ve b'day se pehle 9 dislike bhi ho gaye.,2016-04-07T09:05:34.000Z,13
572,A very awesome trailer n I m sure it will be a hit. But SRK?? I don't like him.,2016-04-07T09:04:00.000Z,0
573,supre,2016-04-07T09:00:16.000Z,0
574,"Kind of a new concept!Looks amazing.
 Will be waiting for the movie :) :)",2016-04-07T08:59:10.000Z,0
575,Awesome,2016-04-07T08:58:13.000Z,0
576,#respect,2016-04-07T08:29:38.000Z,0
577,feels amusing,2016-04-07T08:06:49.000Z,0
578,wow... amazing trailer and undoubtedly an amazing movie,2016-04-07T07:58:36.000Z,0
579,"Nagesh is back!
got goosebumps  @ 0:43 goosebumps stayed....@ 1:07 more goosebumps....chaar chirag tere.....eagerly waiting for it!",2016-04-07T07:58:17.000Z,0
580,"This is amazing:)))
Waiting ....",2016-04-07T07:31:41.000Z,0
581,This is going to be great film.Our Bollywood need more such movies.,2016-04-07T06:57:37.000Z,0
582,"Nagesh has so much Heart, it shows in everything he does. One of the greatest storytellers of our country. A definite watch!",2016-04-07T05:57:26.000Z,2
583,Awesome trailer I love it,2016-04-07T05:55:23.000Z,0
584,Thank you already kukunoor.,2016-04-07T05:07:11.000Z,1
585,Goosebumps..... indeed festival of goosebumps... brilliant.. brilliant.. brilliant ..... what a trailer!,2016-04-07T04:43:27.000Z,0
586,Why don't people see these types of trailers. Really very interesting stuff,2016-04-07T04:06:08.000Z,0
587,"Trailer looks more promising than, other high budget movies.. May She Met her super hero #SRK.. <3 LOVE FROM SOUTH.. <3",2016-04-07T04:05:03.000Z,3
588,ultimate,2016-04-07T03:56:51.000Z,0
589,wow must watch,2016-04-07T03:55:15.000Z,0
590,srk ka naam liya to hit hai boss,2016-04-07T02:53:21.000Z,1
591,nice promo.superb,2016-04-07T02:41:05.000Z,0
592,"The boy's comments apply to real life - idols cannot answer prayers , not to mention, even the boy's own prayers for years....",2016-04-07T02:33:05.000Z,0
593,"@NAGESH SIR , I JUST LOVE THE FILM & @SRK , thanks.",2016-04-07T02:27:03.000Z,1
594,This! THISSS! This is true cinema!,2016-04-07T01:43:57.000Z,1
595,i m sold,2016-04-07T01:27:21.000Z,1
596,Awesome trailer,2016-04-06T21:45:18.000Z,0
597,jab wo letter likh rahi hai to Hindi mein subtitle kyun nahi rakha.. Hindi movie hai Hindi subtitle rakhte.. (the one within the trailer),2016-04-06T21:43:59.000Z,0
598,"Bollywood needs movies like this,  not FAN,rocky handsome bullshit",2016-04-06T21:08:29.000Z,2
599,Is SRK doing special guest in this movie,2016-04-06T20:44:30.000Z,0
600,Brilliant trailer... SRK name is enough to watch this movie... LOVE U GLOBAL STAR SRK,2016-04-06T19:21:23.000Z,0
601,best wishes from srkian,2016-04-06T19:17:00.000Z,0
602,"Nagesh kukunoor's movies are always different and superb witha real touch..
This will also be a masterpiece.",2016-04-06T19:00:39.000Z,0
603,I saw this  movie last year in Germany Stuttgart. It´s not new. But Movies name is Rainbow (Dhanak),2016-04-06T18:35:24.000Z,0
604,My nephew is stubborn as well,2016-04-06T18:24:23.000Z,2
605,operation bhai karwa rahein hain aur film madarchod srk pe ban raha hain... bsdk,2016-04-06T18:11:52.000Z,0
606,overwhelmed,2016-04-06T18:10:21.000Z,0
607,Nagesh ji...superb trailer,2016-04-06T17:59:13.000Z,0
608,wow its look awesome,2016-04-06T17:46:27.000Z,0
609,Mind blowing trailer,2016-04-06T17:44:45.000Z,0
610,So Now I Will Have To See.. Only For Shah Rukh Khan,2016-04-06T17:40:54.000Z,1
611,seems to be nice movie.,2016-04-06T17:11:48.000Z,0
612,epic reply by the kid in the end :D can't wait :),2016-04-06T17:05:37.000Z,1
613,Worth watching it many times,2016-04-06T16:48:26.000Z,0
614,king khan,2016-04-06T16:38:18.000Z,0
615,have been a kuknoor fan since Hyderabad blues!! awesome-- back to iqbal and dor magic..,2016-04-06T16:33:15.000Z,0
616,promising movie,2016-04-06T16:31:37.000Z,0
617,i am all looking forward to it!!,2016-04-06T16:22:40.000Z,0
618,"Woowww amazing! After FAN, now Dhanak..... 
This year really great for SRK...happy for him :)
Now I think I need to watch Dhanak as well...i'm big fan like these kids...  :)",2016-04-06T16:02:03.000Z,0
619,classic...!!!,2016-04-06T15:58:26.000Z,0
620,Really beautiful trailer... Nagesh Kukunoor rocks as usual...Best wishes....,2016-04-06T15:55:31.000Z,7
621,"I love that trailer coz three things  
Srk srk &srk",2016-04-06T15:49:46.000Z,0
622,Sooooo nice,2016-04-06T15:46:26.000Z,0
623,Agar kisi cheez ko dil se chaaho to puri kayanat usey tumse milane ki koshish mein lag jaati hai.its srk,2016-04-06T15:12:43.000Z,5
624,woooooooow this is great,2016-04-06T15:06:31.000Z,0
625,wowwww!!!! extremely excited for this one!! nagesh kukunoor is a genius...hope kids get to meet Shah sir at the end :) love u SRK..u r the most loved person :),2016-04-06T14:47:26.000Z,0
626,Just came here for srk 😍,2016-04-06T14:45:05.000Z,4
627,last scene was epic😂😂😂,2016-04-06T14:28:07.000Z,0
628,Proud to be a Shah Rukh Khan fan from Morocco.,2016-04-06T14:20:09.000Z,0
629,❤️❤️❤️❤️,2016-04-06T14:16:08.000Z,0
630,wow awesome,2016-04-06T14:16:02.000Z,0
631,no words to explain this awesome trailer..... will watch it in hall straight away.....,2016-04-06T14:14:51.000Z,6
632,"Movies that make this world beautiful and touch the hearts, it is what people need especially in today's time, not heroes larger than life, like Superman and Batman, just people and their faith and I really hope that people understand it too and will love this beautiful film.",2016-04-06T13:58:36.000Z,0
633,nice movie trailer,2016-04-06T13:46:28.000Z,0
634,God this looks so adorable,2016-04-06T13:46:02.000Z,0
635,after #fanthefilm its the best trailer i wacthed till now,2016-04-06T13:30:59.000Z,1
636,"LOVE HIM OR HATE HIM,YOU JUST CANNOT IGNORE HIM---SRK",2016-04-06T13:26:33.000Z,0
637,amazing trailer yaar.....It woulb be lovely if SRK can play a cameo in this.,2016-04-06T13:23:25.000Z,1
638,Trailer is awesome it is the first reason to watch.. being based on SRK is the other main reason to watch the film.. :),2016-04-06T13:16:54.000Z,15
639,whenever and wherever ther is SHAH RUKH KHAN then don't worry mate..He is the GOLDEN HEARTED human..LOve and respect,2016-04-06T13:01:34.000Z,6
640,Another FAN movie on King,2016-04-06T12:54:29.000Z,1
641,"looks Promising, Even If All SRKians watch The Flick the Movie will Be Super-Hit!",2016-04-06T12:46:57.000Z,1
642,wowww,2016-04-06T12:45:01.000Z,3
643,"Wow Eagerly waiting for this movie after FAN.
Love you srk 🙏🙏",2016-04-06T12:40:03.000Z,0
644,very good,2016-04-06T12:28:32.000Z,0
645,"I think this Movie Gonna Be a Beautiful Hit.
B'coz this Movie Already Won & Winning international Awards.
Waiting Eagerly for this Movie after a #FAN Movie :-)",2016-04-06T12:10:21.000Z,4
646,m not a srk fan but this movie looking amazing ! hope srk will help them 😊,2016-04-06T12:09:58.000Z,0
647,It took me back in time. Reminded me a lot about my life. Outstanding,2016-04-06T11:52:21.000Z,0
648,"mast trailer.....
may be the  best movie of 2016..",2016-04-06T11:49:48.000Z,1
649,Looks like a hit !!,2016-04-06T11:47:12.000Z,0
650,"I am just blown away! 
Thank you for making such movies. It looks so promising and yes a way emotional for FANS. 

All the best. :D",2016-04-06T11:47:03.000Z,0
651,wow !! this look amazing 😊😊,2016-04-06T11:42:45.000Z,0
652,❤,2016-04-06T11:42:07.000Z,0
653,brilliant! as well as emotional! :(( as SRK says Agar kisi cheez ko dil se chaaho to puri kayanat usey tumse milane ki koshish mein lag jaati hai... this goes for Pari aswell :)))) i hope Pari fulfills her wish for Chotu :)))))) #SRKFan #InspirationalSRK <3,2016-04-06T11:41:14.000Z,13
654,interesting trailer. Can't wait to watch it.,2016-04-06T11:19:31.000Z,1
655,Looks amazing!,2016-04-06T11:12:59.000Z,1
656,Omg I can't wait... We LOVE Srk! <3,2016-04-06T11:10:14.000Z,1
657,#WatchList,2016-04-06T10:59:32.000Z,2
658,Aww.. The trailer is adorable.. Both kids are fantastic.. Will definitely watch if it releases at my place.. - SRKian,2016-04-06T10:51:47.000Z,1
659,We want English subtitles please we all love SRK,2016-04-06T10:51:04.000Z,97
660,it seems like we have no other superstars except srk,2016-04-06T10:49:43.000Z,0
661,Will watch it if it comes to the USA,2016-04-06T10:44:00.000Z,1
662,looks Awesome ... my dream also meet to SRK. one day .👍👌,2016-04-06T10:40:58.000Z,4
663,The Global Superstar for a Reason :*,2016-04-06T10:31:35.000Z,1
664,10 July calender marked ❤,2016-04-06T10:15:34.000Z,0
665,it's all about Srk ...Epic,2016-04-06T10:01:18.000Z,1
666,it's all about Srk ...Epic,2016-04-06T10:01:09.000Z,0
667,What a beautiful film this looks like :-),2016-04-06T09:56:35.000Z,1
668,best wishes from srkians :),2016-04-06T09:44:28.000Z,11
669,must watch,2016-04-06T09:40:46.000Z,0
670,added to my Must watch List ! All the Best to the team!,2016-04-06T09:40:44.000Z,0
671,Raghuu really looking great,2016-04-06T09:38:47.000Z,2
672,this looks Awesome! A film made with Heart !,2016-04-06T09:38:29.000Z,3
673,"This looks amazing!! :) 
SRK will help her for sure :))",2016-04-06T09:34:19.000Z,12
674,Anda hai kaya... Kyu ap ko b nai dekta😃Awwsm,2016-04-06T09:32:32.000Z,3
675,"OMG! This is so beautiful. Best wishes for your movie, I hope Shah Rukh Khan makes a cameo in it :)",2016-04-06T09:29:02.000Z,1
676,I am here because of Shah Rukh Khan,2016-04-06T09:25:24.000Z,2
677,cute,2016-04-06T09:21:19.000Z,0
678,woow,2016-04-06T09:20:48.000Z,1
679,Must watch. extremely good movie.,2016-04-06T08:46:03.000Z,4
680,Sweet,2016-04-06T08:44:31.000Z,1
681,FAN 2............must watch,2016-04-06T08:29:34.000Z,2
682,can say Nageah is back after lakshmi,2016-04-06T08:18:43.000Z,1
683,"Brilliant,,,, awaited!!!!!",2016-04-06T08:15:58.000Z,2
684,have to. have to. have to.. watch this.,2016-04-06T08:13:54.000Z,8
685,srk magic,2016-04-06T08:12:05.000Z,2
686,Magic,2016-04-06T08:09:41.000Z,3
687,another Shahrukh Khan ji fan...Bhagwaan bhala karey,2016-04-06T07:56:10.000Z,0
688,Blockbuster....,2016-04-06T07:55:52.000Z,2
